[
  {
    "source_id": "blessings-of-khorne",
    "source_type": "faction-rule",
    "timing": "start-of-phase",
    "game_version": { "edition": "10th", "dataslate": "2025-q3" },
    "authored_by": "40kdc-community"
  },
  {
    "source_id": "legendary-killer",
    "source_type": "ability",
    "timing": "before-hit-roll",
    "game_version": { "edition": "10th", "dataslate": "2025-q3" },
    "authored_by": "40kdc-community"
  },
  {
    "source_id": "the-betrayer",
    "source_type": "ability",
    "timing": "end-of-phase",
    "game_version": { "edition": "10th", "dataslate": "2025-q3" },
    "authored_by": "40kdc-community"
  },
  {
    "source_id": "berzerker-frenzy",
    "source_type": "ability",
    "timing": "on-unit-destroyed",
    "game_version": { "edition": "10th", "dataslate": "2025-q3" },
    "authored_by": "40kdc-community"
  }
]
